{
    "$schema": "../schema/pub_timeline.schema.json",
    "cookie": "SESSDATA=<SESSDATA>; bili_jct=<CSRF>",
    "bvid": "BV15U4y1d7TX",
    "timeline": "./data/timeline.csv",
    "offsets": [-52, "auto"],
    "danmakuOffsets": [-52, "auto"],
    "ignoreThreshold": 600,
    "output": "./data/output.txt",
    "cover": "这是一个多P自动发布笔记的测试\n欢迎进入笔记打轴的自动化时代",
    "preface": "【注意】今天也要开开心心地看录播",
    "songAndDanceAbstract": true,
    "publish": false,
    "watch": false
}
